{
  "case_id": "HHG-009",
  "case": {
    "status": "open",
    "verdict": "uncertain",
    "fraud_probability": 0.61,
    "pattern": "card_not_present_fraud",
    "pattern_description": "",
    "affected_txn_ids": [
      "3581141"
    ],
    "first_suspicious_txn_id": "3581141",
    "connected_card_ids": [],
    "connected_device_profiles": [],
    "exposure_usd": 30.02,
    "evidence": [
      {
        "claim": "Customer message in the alert: Customer C08299 message: 'I never made this $30.02 purchase. Please check my card.' Refers to 3581141.",
        "source": "customer",
        "ref": "case_pack:HHG-009.trigger_text",
        "entity_ids": [
          "3581141",
          "C08299"
        ]
      },
      {
        "claim": "Bank model risk score on transaction 3581141 is 0.28 (an input, not a verdict; weight 0 in the evidence scorer)",
        "source": "graph",
        "ref": "query:get_transaction(as_of=2016-12-28 17:10:53, txn=3581141)#call-1",
        "entity_ids": [
          "3581141"
        ]
      },
      {
        "claim": "No shared device, region or recipient email links to other cards' visible fraud in 30 days (contribution +0.00 logit)",
        "source": "graph",
        "ref": "query:shared_origin_scan(as_of=2016-12-28 17:10:53, card=C08299-K1, window_days=30, max_degree=50)#call-4",
        "entity_ids": []
      },
      {
        "claim": "Familiar aspects: amount typical for the card; product code used before (contribution +0.00 logit)",
        "source": "graph",
        "ref": "query:card_history(as_of=2016-12-28 17:10:53, card=C08299-K1, lookback_days=180)#call-3",
        "entity_ids": [
          "3581141"
        ]
      },
      {
        "claim": "Policy/pattern text retrieved: 2. Card-not-present fraud. The number is used online without the card. Amounts and products that don't fit the cardholder's history, often in a burst of two to four within 48 hours. On its own, one unusual online purchas",
        "source": "document",
        "ref": "document:README#card_not_present_fraud",
        "entity_ids": [
          "pattern-card_not_present_fraud"
        ]
      },
      {
        "claim": "Policy/pattern text retrieved: \"3a. A case is not a report Two different things, and the agent produces both. **A case** (`CREATE_CASE`) is the bank's internal record of an investigation. Open one whenever fraud probability reaches 0.30, whenever you ",
        "source": "document",
        "ref": "document:README#§3a",
        "entity_ids": [
          "policy-3a"
        ]
      }
    ],
    "similar_prior_cases": [],
    "summary": "Alert on transaction 3581141 ($30.02, online) for card C08299-K1 was triggered by a customer report disputing the transaction. Assessed fraud probability is 0.61; the evidence does not settle the question (leading hypothesis: card-not-present fraud). Key evidence: No shared device, region or recipient email links to other cards' visible fraud in 30 days; Familiar aspects: amount typical for the card; product code used before. Final actions: BLOCK_CARD, CREATE_CASE.",
    "written_to_graph": true,
    "graph_case_id": "INV-HHG-009-376ab74b8d"
  },
  "evidence_requests": [],
  "next_best_actions": {
    "initial": [
      {
        "action": "BLOCK_CARD",
        "route": "L1",
        "reason": "R2: customer disputes the transaction in the alert; exposure $30.02 ≤ $2,500"
      },
      {
        "action": "CREATE_CASE",
        "route": "auto",
        "reason": "R2: customer disputes the transaction in the alert; §3a: customer dispute"
      }
    ],
    "final": [
      {
        "action": "BLOCK_CARD",
        "route": "L1",
        "reason": "R2: customer disputes the transaction in the alert; exposure $30.02 ≤ $2,500"
      },
      {
        "action": "CREATE_CASE",
        "route": "auto",
        "reason": "R2: customer disputes the transaction in the alert; §3a: customer dispute"
      }
    ],
    "what_changed": "nothing"
  },
  "sar": {
    "file": false,
    "reason": "§3a: no report; fraud is not confirmed or strongly suspected together with exposure over $1,000, a shared origin, or an undocumented coordinated pattern",
    "narrative": "",
    "subjects": [],
    "total_amount_usd": 0,
    "activity_dates": []
  },
  "stop_reason": "The customer's own statement in the alert and the graph evidence already determine the policy actions; further steps are unlikely to change the decision (README §6).",
  "tool_calls": 8,
  "tokens": 0,
  "latency_s": 3.1
}
