{
  "case_id": "HHG-016",
  "case": {
    "status": "open",
    "verdict": "uncertain",
    "fraud_probability": 0.61,
    "pattern": "card_not_present_new_device",
    "pattern_description": "",
    "affected_txn_ids": [
      "3534820"
    ],
    "first_suspicious_txn_id": "3534820",
    "connected_card_ids": [],
    "connected_device_profiles": [],
    "exposure_usd": 59.67,
    "evidence": [
      {
        "claim": "Customer message in the alert: Customer C09988 message: 'I never made this $59.67 purchase. Please check my card.' Refers to 3534820.",
        "source": "customer",
        "ref": "case_pack:HHG-016.trigger_text",
        "entity_ids": [
          "3534820",
          "C09988"
        ]
      },
      {
        "claim": "Bank model risk score on transaction 3534820 is 0.37 (an input, not a verdict; weight 0 in the evidence scorer)",
        "source": "graph",
        "ref": "query:get_transaction(as_of=2016-12-12 01:39:08, txn=3534820)#call-1",
        "entity_ids": [
          "3534820"
        ]
      },
      {
        "claim": "No shared device, region or recipient email links to other cards' visible fraud in 30 days (contribution +0.00 logit)",
        "source": "graph",
        "ref": "query:shared_origin_scan(as_of=2016-12-12 01:39:08, card=C09988-K1, window_days=30, max_degree=50)#call-4",
        "entity_ids": []
      },
      {
        "claim": "20 similar closed cases (lexical similarity ≥ 0.35): weighted fraud share 0.98 vs history base rate 0.84; patterns {'card_not_present_new_device': 20} (contribution +0.00 logit)",
        "source": "graph",
        "ref": "query:similar_cases_vector(as_of=2016-12-12 01:39:08, qv=<21 values>, top_k=20)#call-7",
        "entity_ids": [
          "CC-1880",
          "CC-4343",
          "CC-4350",
          "CC-4628",
          "CC-5037"
        ]
      },
      {
        "claim": "Familiar aspects: amount typical for the card; product code used before (contribution +0.00 logit)",
        "source": "graph",
        "ref": "query:card_history(as_of=2016-12-12 01:39:08, card=C09988-K1, lookback_days=180)#call-3",
        "entity_ids": [
          "3534820"
        ]
      },
      {
        "claim": "Policy/pattern text retrieved: 3. Card-not-present fraud from a new device. Same as above, with the identity record marking the device as `New` for this account, sometimes behind a proxy. Stronger than pattern 2, still not proof: people buy new phones",
        "source": "document",
        "ref": "document:README#card_not_present_new_device",
        "entity_ids": [
          "pattern-card_not_present_new_device"
        ]
      },
      {
        "claim": "Policy/pattern text retrieved: \"3a. A case is not a report Two different things, and the agent produces both. **A case** (`CREATE_CASE`) is the bank's internal record of an investigation. Open one whenever fraud probability reaches 0.30, whenever you ",
        "source": "document",
        "ref": "document:README#§3a",
        "entity_ids": [
          "policy-3a"
        ]
      }
    ],
    "similar_prior_cases": [],
    "summary": "Alert on transaction 3534820 ($59.67, online) for card C09988-K1 was triggered by a customer report disputing the transaction. Assessed fraud probability is 0.61; the evidence does not settle the question (leading hypothesis: card-not-present fraud from a new device). Key evidence: No shared device, region or recipient email links to other cards' visible fraud in 30 days; 20 similar closed cases (lexical similarity ≥ 0.35): weighted fraud share 0.98 vs history base rate 0.84; patterns {'card_not_present_new_device': 20}; Familiar aspects: amount typical for the card; product code used before. Final actions: BLOCK_CARD, CREATE_CASE.",
    "written_to_graph": true,
    "graph_case_id": "INV-HHG-016-815727939b"
  },
  "evidence_requests": [],
  "next_best_actions": {
    "initial": [
      {
        "action": "BLOCK_CARD",
        "route": "L1",
        "reason": "R2: customer disputes the transaction in the alert; exposure $59.67 ≤ $2,500"
      },
      {
        "action": "CREATE_CASE",
        "route": "auto",
        "reason": "R2: customer disputes the transaction in the alert; §3a: customer dispute"
      }
    ],
    "final": [
      {
        "action": "BLOCK_CARD",
        "route": "L1",
        "reason": "R2: customer disputes the transaction in the alert; exposure $59.67 ≤ $2,500"
      },
      {
        "action": "CREATE_CASE",
        "route": "auto",
        "reason": "R2: customer disputes the transaction in the alert; §3a: customer dispute"
      }
    ],
    "what_changed": "nothing"
  },
  "sar": {
    "file": false,
    "reason": "§3a: no report; fraud is not confirmed or strongly suspected together with exposure over $1,000, a shared origin, or an undocumented coordinated pattern",
    "narrative": "",
    "subjects": [],
    "total_amount_usd": 0,
    "activity_dates": []
  },
  "stop_reason": "The customer's own statement in the alert and the graph evidence already determine the policy actions; further steps are unlikely to change the decision (README §6).",
  "tool_calls": 8,
  "tokens": 0,
  "latency_s": 3.13
}
